{
  "$schema": "../../../schemas/l2-backend.schema.json",
  "backend_id": "backend:formal-theory-note-library",
  "title": "Formal Theory Note Library",
  "backend_type": "human_note_library",
  "status": "planned",
  "root_paths": [
    "__FORMAL_THEORY_BACKEND_ROOT__"
  ],
  "purpose": [
    "Bridge an external semi-formal theory note library into AITP L2 without treating the backend root as canonical truth.",
    "Seed concept, derivation_object, bridge, and warning_note candidates from human-maintained theory notes that are explicit enough for later formal export."
  ],
  "artifact_granularity": "One formal-theory note or one derivation-focused note is the atomic reusable backend artifact.",
  "source_policy": {
    "requires_l0_registration": true,
    "allows_direct_canonical_promotion": false,
    "allows_auto_canonical_promotion": false,
    "auto_promotion_domains": [],
    "auto_promotion_requires_coverage_audit": true,
    "auto_promotion_requires_multi_agent_consensus": true,
    "auto_promotion_requires_regression_gate": true,
    "auto_promotion_requires_split_clearance": true,
    "auto_promotion_requires_gap_honesty": true,
    "default_source_type": "local_note"
  },
  "l0_registration": {
    "script": "source-layer/scripts/register_local_note_source.py",
    "required_provenance_fields": [
      "provenance.backend_id",
      "provenance.backend_root",
      "provenance.backend_artifact_kind"
    ],
    "required_locator_fields": [
      "locator.backend_relative_path"
    ]
  },
  "canonical_targets": [
    "concept",
    "derivation_object",
    "bridge",
    "warning_note"
  ],
  "retrieval_hints": [
    "Prefer note-local definitions, equations, lemmas, and derivation skeletons before requesting new summary prose.",
    "When a backend note materially shapes L1, L3, or L4, register that concrete note into L0 first.",
    "Do not infer canonical ontology from folder names alone; ontology must be written explicitly during L2 promotion.",
    "Treat the backend as a semi-formal theory layer first; Lean translation is downstream work rather than the admission ticket for durable L2 use."
  ],
  "notes": "This is a public example card for external formal-theory backends such as a standalone theoretical-physics knowledge network or local derivation-note vault. The intended target is a source-grounded semi-formal backend whose artifacts can later be translated into Lean."
}
