{
  "$schema": "../../schemas/l2-backend.schema.json",
  "backend_id": "backend:theoretical-physics-brain",
  "title": "Theoretical Physics Brain (01 Theoretical Physics)",
  "backend_type": "human_note_library",
  "status": "active",
  "root_paths": [
    "__THEORETICAL_PHYSICS_BRAIN_ROOT__"
  ],
  "purpose": [
    "Register the Obsidian folder `obsidian-markdown/01 Theoretical Physics` as the operator-primary, human-readable downstream realization of the theoretical-physics knowledge network inside a working clone.",
    "Support evidence-led formal-theory promotion packets that land in canonical notes while staying semantically aligned with the paired `backend:theoretical-physics-knowledge-network` structured backend."
  ],
  "artifact_granularity": "One canonical note, or one tightly coupled note bundle declared by the local domain index and unresolved queue, is the atomic human-facing backend artifact.",
  "source_policy": {
    "requires_l0_registration": true,
    "allows_direct_canonical_promotion": false,
    "allows_auto_canonical_promotion": true,
    "auto_promotion_domains": [
      "theory-formal"
    ],
    "auto_promotion_requires_coverage_audit": true,
    "auto_promotion_requires_multi_agent_consensus": true,
    "auto_promotion_requires_regression_gate": true,
    "auto_promotion_requires_split_clearance": true,
    "auto_promotion_requires_gap_honesty": true,
    "default_source_type": "local_note"
  },
  "l0_registration": {
    "script": "source-layer/scripts/register_local_note_source.py",
    "required_provenance_fields": [
      "provenance.backend_id",
      "provenance.backend_root",
      "provenance.backend_artifact_kind"
    ],
    "required_locator_fields": [
      "locator.backend_relative_path"
    ]
  },
  "canonical_targets": [
    "concept",
    "definition_card",
    "notation_card",
    "equation_card",
    "assumption_card",
    "regime_card",
    "theorem_card",
    "claim_card",
    "proof_fragment",
    "derivation_step",
    "derivation_object",
    "method",
    "workflow",
    "topic_skill_projection",
    "bridge",
    "example_card",
    "caveat_card",
    "equivalence_map",
    "symbol_binding",
    "validation_pattern",
    "warning_note"
  ],
  "retrieval_hints": [
    "Start from the domain index, existing canonical notes, and unresolved queues in `obsidian-markdown/01 Theoretical Physics` before creating a new note.",
    "Require explicit evidence anchors, assumptions, regime limits, and reusable identity before treating a note as promotion-ready.",
    "Treat folder layout as navigation rather than ontology; reusable identity must still be written explicitly in the note and promotion packet.",
    "When the paired `backend:theoretical-physics-knowledge-network` backend is also active, keep semantic identity, source anchors, assumptions, regime limits, and unresolved-gap boundaries aligned across the human-readable and typed surfaces.",
    "Treat this backend as operator-primary for reading, curation, and domain narrative; that role does not make it globally more authoritative than the paired typed backend."
  ],
  "notes": "This card promotes the active Obsidian theoretical-physics brain to a formal AITP backend. It is explicitly paired with `backend:theoretical-physics-knowledge-network`. Under the paired-backend pattern, the brain and the standalone TPKN repository are governed paired realizations of the same formal-theory knowledge network. The brain is operator-primary, TPKN is machine-primary, and neither backend gains silent authority from format alone. See `canonical/backends/THEORETICAL_PHYSICS_PAIRED_BACKEND_CONTRACT.md`."
}
